,,True,0,[],tar,4.4.19,2026-04-12 12:35:38.121172+00:00,CVSS:3.1/AV:N/AC:L/PR:N/UI:R/S:C/C:H/I:L/A:N,8.2,,,0,2026-04-12,,,"**Vulnerability Namespace:** github:language:javascript NEWLINE **Vulnerability Description:** node-tar Vulnerable to Arbitrary File Creation/Overwrite via Hardlink Path Traversal NEWLINE **Related Vulnerability Description:** node-tar,a Tar for Node.js, contains a vulnerability in versions prior to 7.5.7 where the security check for hardlink entries uses different path resolution semantics than the actual hardlink creation logic. This mismatch allows an attacker to craft a malicious TAR archive that bypasses path traversal protections and creates hardlinks to arbitrary files outside the extraction directory. Version 7.5.7 contains a fix for the issue. NEWLINE **Matcher:** javascript-matcher NEWLINE **Package URL:** pkg:npm/tar@4.4.19",False,,,False,,0.01889,0.00012,False,/juice-shop/node_modules/node-pre-gyp/node_modules/tar/package.json,,True,7.5.7,True,False,,False,,5f048978793933567b9f47c2a1cda291cffc0fc85e54ca1dafe8f4c847729c66,888,,False,,False,2026-04-12 12:35:37.658338+00:00,Admin User (admin),1,2026-04-12 12:35:38.121220+00:00,,,,,0,[],Upgrade to version: 7.5.7,1,S1,False,,,,,,,,False,**Vulnerability Datasource:** https://github.com/advisories/GHSA-34x7-hfp2-rc4v NEWLINE **Vulnerability URLs:** NEWLINE - https://github.com/isaacs/node-tar/security/advisories/GHSA-34x7-hfp2-rc4v NEWLINE - https://nvd.nist.gov/vuln/detail/CVE-2026-24842 NEWLINE - https://github.com/isaacs/node-tar/commit/f4a7aa9bc3d717c987fdf1480ff7a64e87ffdb46 NEWLINE **Related Vulnerability Datasource:** https://nvd.nist.gov/vuln/detail/CVE-2026-24842 NEWLINE **Related Vulnerability URLs:** NEWLINE - https://github.com/isaacs/node-tar/commit/f4a7aa9bc3d717c987fdf1480ff7a64e87ffdb46 NEWLINE - https://github.com/isaacs/node-tar/security/advisories/GHSA-34x7-hfp2-rc4v,Admin User (admin),1,,,False,,,,,,,High,,1,30,29,2026-05-12,2026-05-12,,,,True,,Anchore Grype,20,0,GHSA-34x7-hfp2-rc4v in tar:4.4.19,False,False,,2026-04-12 12:35:38.121179+00:00,,False,,GHSA-34x7-hfp2-rc4v,,Anchore Grype,3,Labs Security Testing Final,1,Juice Shop,,GHSA-34x7-hfp2-rc4v; CVE-2026-24842,,Active,
,,True,0,[],tar,6.2.1,2026-04-12 12:35:38.125418+00:00,CVSS:3.1/AV:N/AC:L/PR:N/UI:R/S:C/C:H/I:L/A:N,8.2,,,0,2026-04-12,,,"**Vulnerability Namespace:** github:language:javascript NEWLINE **Vulnerability Description:** node-tar Vulnerable to Arbitrary File Creation/Overwrite via Hardlink Path Traversal NEWLINE **Related Vulnerability Description:** node-tar,a Tar for Node.js, contains a vulnerability in versions prior to 7.5.7 where the security check for hardlink entries uses different path resolution semantics than the actual hardlink creation logic. This mismatch allows an attacker to craft a malicious TAR archive that bypasses path traversal protections and creates hardlinks to arbitrary files outside the extraction directory. Version 7.5.7 contains a fix for the issue. NEWLINE **Matcher:** javascript-matcher NEWLINE **Package URL:** pkg:npm/tar@6.2.1",False,,,False,,0.01889,0.00012,False,/juice-shop/node_modules/sqlite3/node_modules/tar/package.json,,True,7.5.7,True,False,,False,,8b5ae5ab055bc6565ff4914f00116bb4600a78e77846f6ec062a884c2051fda1,889,,False,,False,2026-04-12 12:35:37.658338+00:00,Admin User (admin),1,2026-04-12 12:35:38.125461+00:00,,,,,0,[],Upgrade to version: 7.5.7,1,S1,False,,,,,,,,False,**Vulnerability Datasource:** https://github.com/advisories/GHSA-34x7-hfp2-rc4v NEWLINE **Vulnerability URLs:** NEWLINE - https://github.com/isaacs/node-tar/security/advisories/GHSA-34x7-hfp2-rc4v NEWLINE - https://nvd.nist.gov/vuln/detail/CVE-2026-24842 NEWLINE - https://github.com/isaacs/node-tar/commit/f4a7aa9bc3d717c987fdf1480ff7a64e87ffdb46 NEWLINE **Related Vulnerability Datasource:** https://nvd.nist.gov/vuln/detail/CVE-2026-24842 NEWLINE **Related Vulnerability URLs:** NEWLINE - https://github.com/isaacs/node-tar/commit/f4a7aa9bc3d717c987fdf1480ff7a64e87ffdb46 NEWLINE - https://github.com/isaacs/node-tar/security/advisories/GHSA-34x7-hfp2-rc4v,Admin User (admin),1,,,False,,,,,,,High,,1,30,29,2026-05-12,2026-05-12,,,,True,,Anchore Grype,20,0,GHSA-34x7-hfp2-rc4v in tar:6.2.1,False,False,,2026-04-12 12:35:38.125424+00:00,,False,,GHSA-34x7-hfp2-rc4v,,Anchore Grype,3,Labs Security Testing Final,1,Juice Shop,,GHSA-34x7-hfp2-rc4v; CVE-2026-24842,,Active,
,,True,0,[],tar,7.4.3,2026-04-12 12:35:38.130403+00:00,CVSS:3.1/AV:N/AC:L/PR:N/UI:R/S:C/C:H/I:L/A:N,8.2,,,0,2026-04-12,,,"**Vulnerability Namespace:** github:language:javascript NEWLINE **Vulnerability Description:** node-tar Vulnerable to Arbitrary File Creation/Overwrite via Hardlink Path Traversal NEWLINE **Related Vulnerability Description:** node-tar,a Tar for Node.js, contains a vulnerability in versions prior to 7.5.7 where the security check for hardlink entries uses different path resolution semantics than the actual hardlink creation logic. This mismatch allows an attacker to craft a malicious TAR archive that bypasses path traversal protections and creates hardlinks to arbitrary files outside the extraction directory. Version 7.5.7 contains a fix for the issue. NEWLINE **Matcher:** javascript-matcher NEWLINE **Package URL:** pkg:npm/tar@7.4.3",False,,,False,,0.01889,0.00012,False,/juice-shop/node_modules/tar/package.json,,True,7.5.7,True,False,,False,,5f3e4d28569b979cdb52f1f75996dd7caf79fc90c381d064837ea289e72c30d0,890,,False,,False,2026-04-12 12:35:37.658338+00:00,Admin User (admin),1,2026-04-12 12:35:38.130478+00:00,,,,,0,[],Upgrade to version: 7.5.7,1,S1,False,,,,,,,,False,**Vulnerability Datasource:** https://github.com/advisories/GHSA-34x7-hfp2-rc4v NEWLINE **Vulnerability URLs:** NEWLINE - https://github.com/isaacs/node-tar/security/advisories/GHSA-34x7-hfp2-rc4v NEWLINE - https://nvd.nist.gov/vuln/detail/CVE-2026-24842 NEWLINE - https://github.com/isaacs/node-tar/commit/f4a7aa9bc3d717c987fdf1480ff7a64e87ffdb46 NEWLINE **Related Vulnerability Datasource:** https://nvd.nist.gov/vuln/detail/CVE-2026-24842 NEWLINE **Related Vulnerability URLs:** NEWLINE - https://github.com/isaacs/node-tar/commit/f4a7aa9bc3d717c987fdf1480ff7a64e87ffdb46 NEWLINE - https://github.com/isaacs/node-tar/security/advisories/GHSA-34x7-hfp2-rc4v,Admin User (admin),1,,,False,,,,,,,High,,1,30,29,2026-05-12,2026-05-12,,,,True,,Anchore Grype,20,0,GHSA-34x7-hfp2-rc4v in tar:7.4.3,False,False,,2026-04-12 12:35:38.130413+00:00,,False,,GHSA-34x7-hfp2-rc4v,,Anchore Grype,3,Labs Security Testing Final,1,Juice Shop,,GHSA-34x7-hfp2-rc4v; CVE-2026-24842,,Active,
,,True,0,[],multer,1.4.5-lts.2,2026-04-12 12:35:38.136080+00:00,CVSS:3.1/AV:N/AC:L/PR:N/UI:N/S:U/C:N/I:N/A:H,7.5,,,0,2026-04-12,,,"**Vulnerability Namespace:** github:language:javascript NEWLINE **Vulnerability Description:** Multer vulnerable to Denial of Service via unhandled exception from malformed request NEWLINE **Related Vulnerability Description:** Multer is a node.js middleware for handling `multipart/form-data`. A vulnerability that is present starting in version 1.4.4-lts.1 and prior to version 2.0.2 allows an attacker to trigger a Denial of Service (DoS) by sending a malformed multi-part upload request. This request causes an unhandled exception, leading to a crash of the process. Users should upgrade to version 2.0.2 to receive a patch. No known workarounds are available. NEWLINE **Matcher:** javascript-matcher NEWLINE **Package URL:** pkg:npm/multer@1.4.5-lts.2",False,,,False,,0.01553,0.00012,False,/juice-shop/node_modules/multer/package.json,,True,2.0.2,True,False,,False,,aeeed161b43b47649735bd042aa9e630e5f28c400c888417fc0720be9c2e7a7e,891,,False,,False,2026-04-12 12:35:37.658338+00:00,Admin User (admin),1,2026-04-12 12:35:38.136143+00:00,,,,,0,[],Upgrade to version: 2.0.2,1,S1,False,,,,,,,,False,**Vulnerability Datasource:** https://github.com/advisories/GHSA-fjgf-rc76-4x9p NEWLINE **Vulnerability URLs:** NEWLINE - https://github.com/expressjs/multer/security/advisories/GHSA-fjgf-rc76-4x9p NEWLINE - https://nvd.nist.gov/vuln/detail/CVE-2025-7338 NEWLINE - https://github.com/expressjs/multer/commit/adfeaf669f0e7fe953eab191a762164a452d143b NEWLINE - https://cna.openjsf.org/security-advisories.html NEWLINE **Related Vulnerability Datasource:** https://nvd.nist.gov/vuln/detail/CVE-2025-7338 NEWLINE **Related Vulnerability URLs:** NEWLINE - https://cna.openjsf.org/security-advisories.html NEWLINE - https://github.com/expressjs/multer/commit/adfeaf669f0e7fe953eab191a762164a452d143b NEWLINE - https://github.com/expressjs/multer/security/advisories/GHSA-fjgf-rc76-4x9p,Admin User (admin),1,,,False,,,,,,,High,,1,30,29,2026-05-12,2026-05-12,,,,True,,Anchore Grype,20,0,GHSA-fjgf-rc76-4x9p in multer:1.4.5-lts.2,False,False,,2026-04-12 12:35:38.136088+00:00,,False,,GHSA-fjgf-rc76-4x9p,,Anchore Grype,3,Labs Security Testing Final,1,Juice Shop,,GHSA-fjgf-rc76-4x9p; CVE-2025-7338,,Active,
,,True,0,[],multer,1.4.5-lts.2,2026-04-12 12:35:38.142611+00:00,CVSS:3.1/AV:N/AC:L/PR:N/UI:N/S:U/C:N/I:N/A:H,7.5,,,0,2026-04-12,,,"**Vulnerability Namespace:** github:language:javascript NEWLINE **Vulnerability Description:** Multer vulnerable to Denial of Service from maliciously crafted requests NEWLINE **Related Vulnerability Description:** Multer is a node.js middleware for handling `multipart/form-data`. A vulnerability that is present starting in version 1.4.4-lts.1 and prior to version 2.0.0 allows an attacker to trigger a Denial of Service (DoS) by sending a malformed multi-part upload request. This request causes an unhandled exception, leading to a crash of the process. Users should upgrade to version 2.0.0 to receive a patch. No known workarounds are available. NEWLINE **Matcher:** javascript-matcher NEWLINE **Package URL:** pkg:npm/multer@1.4.5-lts.2",False,,,False,,0.01494,0.00011,False,/juice-shop/node_modules/multer/package.json,,True,2.0.0,True,False,,False,,e361ef84b7e55dd3b2c90b9d8fb942526c15c129d1f901c7d3c7bc176d1f7764,892,,False,,False,2026-04-12 12:35:37.658338+00:00,Admin User (admin),1,2026-04-12 12:35:38.142674+00:00,,,,,0,[],Upgrade to version: 2.0.0,1,S1,False,,,,,,,,False,**Vulnerability Datasource:** https://github.com/advisories/GHSA-4pg4-qvpc-4q3h NEWLINE **Vulnerability URLs:** NEWLINE - https://github.com/expressjs/multer/security/advisories/GHSA-4pg4-qvpc-4q3h NEWLINE - https://nvd.nist.gov/vuln/detail/CVE-2025-47944 NEWLINE - https://github.com/expressjs/multer/issues/1176 NEWLINE - https://github.com/expressjs/multer/commit/2c8505f207d923dd8de13a9f93a4563e59933665 NEWLINE **Related Vulnerability Datasource:** https://nvd.nist.gov/vuln/detail/CVE-2025-47944 NEWLINE **Related Vulnerability URLs:** NEWLINE - https://github.com/expressjs/multer/commit/2c8505f207d923dd8de13a9f93a4563e59933665 NEWLINE - https://github.com/expressjs/multer/issues/1176 NEWLINE - https://github.com/expressjs/multer/security/advisories/GHSA-4pg4-qvpc-4q3h,Admin User (admin),1,,,False,,,,,,,High,,1,30,29,2026-05-12,2026-05-12,,,,True,,Anchore Grype,20,0,GHSA-4pg4-qvpc-4q3h in multer:1.4.5-lts.2,False,False,,2026-04-12 12:35:38.142622+00:00,,False,,GHSA-4pg4-qvpc-4q3h,,Anchore Grype,3,Labs Security Testing Final,1,Juice Shop,,GHSA-4pg4-qvpc-4q3h; CVE-2025-47944,,Active,
,,True,0,[],jws,0.2.6,2026-04-12 12:35:38.163781+00:00,CVSS:3.1/AV:N/AC:L/PR:N/UI:N/S:U/C:N/I:H/A:N,7.5,,,0,2026-04-12,,,"**Vulnerability Namespace:** github:language:javascript NEWLINE **Vulnerability Description:** auth0/node-jws Improperly Verifies HMAC Signature NEWLINE **Related Vulnerability Description:** auth0/node-jws is a JSON Web Signature implementation for Node.js. In versions 3.2.2 and earlier and version 4.0.0, auth0/node-jws has an improper signature verification vulnerability when using the HS256 algorithm under specific conditions. Applications are affected when they use the jws.createVerify() function for HMAC algorithms and use user-provided data from the JSON Web Signature protected header or payload in HMAC secret lookup routines, which can allow attackers to bypass signature verification. This issue has been patched in versions 3.2.3 and 4.0.1. NEWLINE **Matcher:** javascript-matcher NEWLINE **Package URL:** pkg:npm/jws@0.2.6",False,,,False,,0.00924,9e-05,False,/juice-shop/node_modules/jws/package.json,,True,3.2.3,True,False,,False,,dfe2f28ff7fb299086ffa9541269f2ec2232e1d78b0c48df509ef2efe1c15665,895,,False,,False,2026-04-12 12:35:37.658338+00:00,Admin User (admin),1,2026-04-12 12:35:38.163928+00:00,,,,,0,[],Upgrade to version: 3.2.3,1,S1,False,,,,,,,,False,**Vulnerability Datasource:** https://github.com/advisories/GHSA-869p-cjfg-cm3x NEWLINE **Vulnerability URLs:** NEWLINE - https://github.com/auth0/node-jws/security/advisories/GHSA-869p-cjfg-cm3x NEWLINE - https://github.com/auth0/node-jws/commit/34c45b2c04434f925b638de6a061de9339c0ea2e NEWLINE - https://github.com/auth0/node-jws/commit/4f6e73f24df42f07d632dec6431ade8eda8d11a6 NEWLINE - https://github.com/auth0/node-jws/releases/tag/v3.2.3 NEWLINE - https://github.com/auth0/node-jws/releases/tag/v4.0.1 NEWLINE - https://nvd.nist.gov/vuln/detail/CVE-2025-65945 NEWLINE **Related Vulnerability Datasource:** https://nvd.nist.gov/vuln/detail/CVE-2025-65945 NEWLINE **Related Vulnerability URLs:** NEWLINE - https://github.com/auth0/node-jws/commit/34c45b2c04434f925b638de6a061de9339c0ea2e NEWLINE - https://github.com/auth0/node-jws/security/advisories/GHSA-869p-cjfg-cm3x,Admin User (admin),1,,,False,,,,,,,High,,1,30,29,2026-05-12,2026-05-12,,,,True,,Anchore Grype,20,0,GHSA-869p-cjfg-cm3x in jws:0.2.6,False,False,,2026-04-12 12:35:38.163798+00:00,,False,,GHSA-869p-cjfg-cm3x,,Anchore Grype,3,Labs Security Testing Final,1,Juice Shop,,GHSA-869p-cjfg-cm3x; CVE-2025-65945,,Active,
,,True,0,[],tar,4.4.19,2026-04-12 12:35:38.189643+00:00,CVSS:3.1/AV:N/AC:L/PR:N/UI:R/S:C/C:L/I:H/A:L,8.8,,,0,2026-04-12,,,"**Vulnerability Namespace:** github:language:javascript NEWLINE **Vulnerability Description:** Race Condition in node-tar Path Reservations via Unicode Ligature Collisions on macOS APFS NEWLINE **Related Vulnerability Description:** node-tar,a Tar for Node.js, has a race condition vulnerability in versions up to and including 7.5.3. This is due to an incomplete handling of Unicode path collisions in the `path-reservations` system. On case-insensitive or normalization-insensitive filesystems (such as macOS APFS, In which it has been tested), the library fails to lock colliding paths (e.g., `ß` and `ss`), allowing them to be processed in parallel. This bypasses the library's internal concurrency safeguards and permits Symlink Poisoning attacks via race conditions. The library uses a `PathReservations` system to ensure that metadata checks and file operations for the same path are serialized. This prevents race conditions where one entry might clobber another concurrently. This is a Race Condition which enables Arbitrary File Overwrite. This vulnerability affects users and systems using node-tar on macOS (APFS/HFS+). Because of using `NFD` Unicode normalization (in which `ß` and `ss` are different), conflicting paths do not have their order properly preserved under filesystems that ignore Unicode normalization (e.g., APFS (in which `ß` causes an inode collision with `ss`)). This enables an attacker to circumvent internal parallelization locks (`PathReservations`) using conflicting filenames within a malicious tar archive. The patch in version 7.5.4 updates `path-reservations.js` to use a normalization form that matches the target filesystem's behavior (e.g., `NFKD`), followed by first `toLocaleLowerCase('en')` and then `toLocaleUpperCase('en')`. As a workaround, users who cannot upgrade promptly, and who are programmatically using `node-tar` to extract arbitrary tarball data should filter out all `SymbolicLink` entries (as npm does) to defend against arbitrary file writes via this file system entry name collision issue. NEWLINE **Matcher:** javascript-matcher NEWLINE **Package URL:** pkg:npm/tar@4.4.19",False,,,False,,0.00308,6e-05,False,/juice-shop/node_modules/node-pre-gyp/node_modules/tar/package.json,,True,7.5.4,True,False,,False,,2ed1efb9df4bedea88b2e627e0130174bd343fe820b8fad3a39264e21c48fad8,899,,False,,False,2026-04-12 12:35:37.658338+00:00,Admin User (admin),1,2026-04-12 12:35:38.189704+00:00,,,,,0,[],Upgrade to version: 7.5.4,1,S1,False,,,,,,,,False,**Vulnerability Datasource:** https://github.com/advisories/GHSA-r6q2-hw4h-h46w NEWLINE **Vulnerability URLs:** NEWLINE - https://github.com/isaacs/node-tar/security/advisories/GHSA-r6q2-hw4h-h46w NEWLINE - https://nvd.nist.gov/vuln/detail/CVE-2026-23950 NEWLINE - https://github.com/isaacs/node-tar/commit/3b1abfae650056edfabcbe0a0df5954d390521e6 NEWLINE **Related Vulnerability Datasource:** https://nvd.nist.gov/vuln/detail/CVE-2026-23950 NEWLINE **Related Vulnerability URLs:** NEWLINE - https://github.com/isaacs/node-tar/commit/3b1abfae650056edfabcbe0a0df5954d390521e6 NEWLINE - https://github.com/isaacs/node-tar/security/advisories/GHSA-r6q2-hw4h-h46w,Admin User (admin),1,,,False,,,,,,,High,,1,30,29,2026-05-12,2026-05-12,,,,True,,Anchore Grype,20,0,GHSA-r6q2-hw4h-h46w in tar:4.4.19,False,False,,2026-04-12 12:35:38.189655+00:00,,False,,GHSA-r6q2-hw4h-h46w,,Anchore Grype,3,Labs Security Testing Final,1,Juice Shop,,GHSA-r6q2-hw4h-h46w; CVE-2026-23950,,Active,
,,True,0,[],tar,6.2.1,2026-04-12 12:35:38.196734+00:00,CVSS:3.1/AV:N/AC:L/PR:N/UI:R/S:C/C:L/I:H/A:L,8.8,,,0,2026-04-12,,,"**Vulnerability Namespace:** github:language:javascript NEWLINE **Vulnerability Description:** Race Condition in node-tar Path Reservations via Unicode Ligature Collisions on macOS APFS NEWLINE **Related Vulnerability Description:** node-tar,a Tar for Node.js, has a race condition vulnerability in versions up to and including 7.5.3. This is due to an incomplete handling of Unicode path collisions in the `path-reservations` system. On case-insensitive or normalization-insensitive filesystems (such as macOS APFS, In which it has been tested), the library fails to lock colliding paths (e.g., `ß` and `ss`), allowing them to be processed in parallel. This bypasses the library's internal concurrency safeguards and permits Symlink Poisoning attacks via race conditions. The library uses a `PathReservations` system to ensure that metadata checks and file operations for the same path are serialized. This prevents race conditions where one entry might clobber another concurrently. This is a Race Condition which enables Arbitrary File Overwrite. This vulnerability affects users and systems using node-tar on macOS (APFS/HFS+). Because of using `NFD` Unicode normalization (in which `ß` and `ss` are different), conflicting paths do not have their order properly preserved under filesystems that ignore Unicode normalization (e.g., APFS (in which `ß` causes an inode collision with `ss`)). This enables an attacker to circumvent internal parallelization locks (`PathReservations`) using conflicting filenames within a malicious tar archive. The patch in version 7.5.4 updates `path-reservations.js` to use a normalization form that matches the target filesystem's behavior (e.g., `NFKD`), followed by first `toLocaleLowerCase('en')` and then `toLocaleUpperCase('en')`. As a workaround, users who cannot upgrade promptly, and who are programmatically using `node-tar` to extract arbitrary tarball data should filter out all `SymbolicLink` entries (as npm does) to defend against arbitrary file writes via this file system entry name collision issue. NEWLINE **Matcher:** javascript-matcher NEWLINE **Package URL:** pkg:npm/tar@6.2.1",False,,,False,,0.00308,6e-05,False,/juice-shop/node_modules/sqlite3/node_modules/tar/package.json,,True,7.5.4,True,False,,False,,94f59c723d8aec5741a0b8f70ca74c1a206755d843633cf5b6dcba3032347c0f,900,,False,,False,2026-04-12 12:35:37.658338+00:00,Admin User (admin),1,2026-04-12 12:35:38.196800+00:00,,,,,0,[],Upgrade to version: 7.5.4,1,S1,False,,,,,,,,False,**Vulnerability Datasource:** https://github.com/advisories/GHSA-r6q2-hw4h-h46w NEWLINE **Vulnerability URLs:** NEWLINE - https://github.com/isaacs/node-tar/security/advisories/GHSA-r6q2-hw4h-h46w NEWLINE - https://nvd.nist.gov/vuln/detail/CVE-2026-23950 NEWLINE - https://github.com/isaacs/node-tar/commit/3b1abfae650056edfabcbe0a0df5954d390521e6 NEWLINE **Related Vulnerability Datasource:** https://nvd.nist.gov/vuln/detail/CVE-2026-23950 NEWLINE **Related Vulnerability URLs:** NEWLINE - https://github.com/isaacs/node-tar/commit/3b1abfae650056edfabcbe0a0df5954d390521e6 NEWLINE - https://github.com/isaacs/node-tar/security/advisories/GHSA-r6q2-hw4h-h46w,Admin User (admin),1,,,False,,,,,,,High,,1,30,29,2026-05-12,2026-05-12,,,,True,,Anchore Grype,20,0,GHSA-r6q2-hw4h-h46w in tar:6.2.1,False,False,,2026-04-12 12:35:38.196745+00:00,,False,,GHSA-r6q2-hw4h-h46w,,Anchore Grype,3,Labs Security Testing Final,1,Juice Shop,,GHSA-r6q2-hw4h-h46w; CVE-2026-23950,,Active,
,,True,0,[],tar,7.4.3,2026-04-12 12:35:38.209780+00:00,CVSS:3.1/AV:N/AC:L/PR:N/UI:R/S:C/C:L/I:H/A:L,8.8,,,0,2026-04-12,,,"**Vulnerability Namespace:** github:language:javascript NEWLINE **Vulnerability Description:** Race Condition in node-tar Path Reservations via Unicode Ligature Collisions on macOS APFS NEWLINE **Related Vulnerability Description:** node-tar,a Tar for Node.js, has a race condition vulnerability in versions up to and including 7.5.3. This is due to an incomplete handling of Unicode path collisions in the `path-reservations` system. On case-insensitive or normalization-insensitive filesystems (such as macOS APFS, In which it has been tested), the library fails to lock colliding paths (e.g., `ß` and `ss`), allowing them to be processed in parallel. This bypasses the library's internal concurrency safeguards and permits Symlink Poisoning attacks via race conditions. The library uses a `PathReservations` system to ensure that metadata checks and file operations for the same path are serialized. This prevents race conditions where one entry might clobber another concurrently. This is a Race Condition which enables Arbitrary File Overwrite. This vulnerability affects users and systems using node-tar on macOS (APFS/HFS+). Because of using `NFD` Unicode normalization (in which `ß` and `ss` are different), conflicting paths do not have their order properly preserved under filesystems that ignore Unicode normalization (e.g., APFS (in which `ß` causes an inode collision with `ss`)). This enables an attacker to circumvent internal parallelization locks (`PathReservations`) using conflicting filenames within a malicious tar archive. The patch in version 7.5.4 updates `path-reservations.js` to use a normalization form that matches the target filesystem's behavior (e.g., `NFKD`), followed by first `toLocaleLowerCase('en')` and then `toLocaleUpperCase('en')`. As a workaround, users who cannot upgrade promptly, and who are programmatically using `node-tar` to extract arbitrary tarball data should filter out all `SymbolicLink` entries (as npm does) to defend against arbitrary file writes via this file system entry name collision issue. NEWLINE **Matcher:** javascript-matcher NEWLINE **Package URL:** pkg:npm/tar@7.4.3",False,,,False,,0.00308,6e-05,False,/juice-shop/node_modules/tar/package.json,,True,7.5.4,True,False,,False,,2e1f1d1a6433c7cf374fe5026aad7a61612352d2abba5856acf85e9a354165fe,901,,False,,False,2026-04-12 12:35:37.658338+00:00,Admin User (admin),1,2026-04-12 12:35:38.209833+00:00,,,,,0,[],Upgrade to version: 7.5.4,1,S1,False,,,,,,,,False,**Vulnerability Datasource:** https://github.com/advisories/GHSA-r6q2-hw4h-h46w NEWLINE **Vulnerability URLs:** NEWLINE - https://github.com/isaacs/node-tar/security/advisories/GHSA-r6q2-hw4h-h46w NEWLINE - https://nvd.nist.gov/vuln/detail/CVE-2026-23950 NEWLINE - https://github.com/isaacs/node-tar/commit/3b1abfae650056edfabcbe0a0df5954d390521e6 NEWLINE **Related Vulnerability Datasource:** https://nvd.nist.gov/vuln/detail/CVE-2026-23950 NEWLINE **Related Vulnerability URLs:** NEWLINE - https://github.com/isaacs/node-tar/commit/3b1abfae650056edfabcbe0a0df5954d390521e6 NEWLINE - https://github.com/isaacs/node-tar/security/advisories/GHSA-r6q2-hw4h-h46w,Admin User (admin),1,,,False,,,,,,,High,,1,30,29,2026-05-12,2026-05-12,,,,True,,Anchore Grype,20,0,GHSA-r6q2-hw4h-h46w in tar:7.4.3,False,False,,2026-04-12 12:35:38.209788+00:00,,False,,GHSA-r6q2-hw4h-h46w,,Anchore Grype,3,Labs Security Testing Final,1,Juice Shop,,GHSA-r6q2-hw4h-h46w; CVE-2026-23950,,Active,
