,,True,0,[],multer,1.4.5-lts.2,2026-04-12 12:35:36.983411+00:00,CVSS:3.1/AV:N/AC:L/PR:N/UI:N/S:U/C:N/I:N/A:H,7.5,,,401,2026-04-12,,,"Multer vulnerable to Denial of Service via memory leaks from unclosed streams NEWLINE **Target:** Node.js NEWLINE **Type:** node-pkg NEWLINE **Fixed version:** 2.0.0 NEWLINE  NEWLINE Multer is a node.js middleware for handling `multipart/form-data`. Versions prior to 2.0.0 are vulnerable to a resource exhaustion and memory leak issue due to improper stream handling. When the HTTP request stream emits an error, the internal `busboy` stream is not closed, violating Node.js stream safety guidance. This leads to unclosed streams accumulating over time, consuming memory and file descriptors. Under sustained or repeated failure conditions, this can result in denial of service, requiring manual server restarts to recover. All users of Multer handling file uploads are potentially impacted. Users should upgrade to 2.0.0 to receive a patch. No known workarounds are available. NEWLINE ",False,,,False,,,,False,juice-shop/node_modules/multer/package.json,,True,,True,False,,False,,bd7c5d742836d0352509a8474ed0a0c95c51a5a63381ad5fc8f27b95701c4f33,760,fixed,False,,False,2026-04-12 12:35:36.239086+00:00,Admin User (admin),1,2026-04-12 12:35:36.983462+00:00,,,,,0,[],2.0.0,,S1,False,,,,,,,,False,https://github.com/expressjs/multer NEWLINE https://github.com/expressjs/multer/commit/2c8505f207d923dd8de13a9f93a4563e59933665 NEWLINE https://github.com/expressjs/multer/pull/1120 NEWLINE https://github.com/expressjs/multer/security/advisories/GHSA-44fp-w29j-9vj5 NEWLINE https://nvd.nist.gov/vuln/detail/CVE-2025-47935,Admin User (admin),1,,,False,,,,,,,High,,1,30,29,2026-05-12,2026-05-12,,,,True,,Trivy Scan,18,0,CVE-2025-47935 Multer 1.4.5-lts.2,False,False,,2026-04-12 12:35:36.983419+00:00,,True,,,,Trivy Scan,3,Labs Security Testing Final,1,Juice Shop,,CVE-2025-47935,lang-pkgs; node-pkg,"Active, Verified",
,,True,0,[],multer,1.4.5-lts.2,2026-04-12 12:35:36.991228+00:00,CVSS:3.1/AV:N/AC:L/PR:N/UI:N/S:U/C:N/I:N/A:H,7.5,,,248,2026-04-12,,,"Multer vulnerable to Denial of Service from maliciously crafted requests NEWLINE **Target:** Node.js NEWLINE **Type:** node-pkg NEWLINE **Fixed version:** 2.0.0 NEWLINE  NEWLINE Multer is a node.js middleware for handling `multipart/form-data`. A vulnerability that is present starting in version 1.4.4-lts.1 and prior to version 2.0.0 allows an attacker to trigger a Denial of Service (DoS) by sending a malformed multi-part upload request. This request causes an unhandled exception, leading to a crash of the process. Users should upgrade to version 2.0.0 to receive a patch. No known workarounds are available. NEWLINE ",False,,,False,,,,False,juice-shop/node_modules/multer/package.json,,True,,True,False,,False,,d54a393560504cbe27d8c6511ce8e775584da954e8e529f7c193cdc23ade5220,761,fixed,False,,False,2026-04-12 12:35:36.239086+00:00,Admin User (admin),1,2026-04-12 12:35:36.991272+00:00,,,,,0,[],2.0.0,,S1,False,,,,,,,,False,https://github.com/expressjs/multer NEWLINE https://github.com/expressjs/multer/commit/2c8505f207d923dd8de13a9f93a4563e59933665 NEWLINE https://github.com/expressjs/multer/issues/1176 NEWLINE https://github.com/expressjs/multer/security/advisories/GHSA-4pg4-qvpc-4q3h NEWLINE https://nvd.nist.gov/vuln/detail/CVE-2025-47944,Admin User (admin),1,,,False,,,,,,,High,,1,30,29,2026-05-12,2026-05-12,,,,True,,Trivy Scan,18,0,CVE-2025-47944 Multer 1.4.5-lts.2,False,False,,2026-04-12 12:35:36.991235+00:00,,True,,,,Trivy Scan,3,Labs Security Testing Final,1,Juice Shop,,CVE-2025-47944,lang-pkgs; node-pkg,"Active, Verified",
,,True,0,[],multer,1.4.5-lts.2,2026-04-12 12:35:37.003043+00:00,,,CVSS:4.0/AV:N/AC:L/AT:N/PR:N/UI:N/VC:N/VI:N/VA:H/SC:N/SI:N/SA:N,8.7,248,2026-04-12,,,"multer: Multer vulnerable to Denial of Service via unhandled exception NEWLINE **Target:** Node.js NEWLINE **Type:** node-pkg NEWLINE **Fixed version:** 2.0.1 NEWLINE  NEWLINE Multer is a node.js middleware for handling `multipart/form-data`. A vulnerability that is present starting in version 1.4.4-lts.1 and prior to version 2.0.1 allows an attacker to trigger a Denial of Service (DoS) by sending an upload file request with an empty string field name. This request causes an unhandled exception, leading to a crash of the process. Users should upgrade to `2.0.1` to receive a patch. No known workarounds are available. NEWLINE ",False,,,False,,,,False,juice-shop/node_modules/multer/package.json,,True,,True,False,,False,,fff2040ca8b13c9b59000f6cdf210be92bb31f2262e7034a504c81950bff1f30,762,fixed,False,,False,2026-04-12 12:35:36.239086+00:00,Admin User (admin),1,2026-04-12 12:35:37.003094+00:00,,,,,0,[],2.0.1,,S1,False,,,,,,,,False,https://access.redhat.com/security/cve/CVE-2025-48997 NEWLINE https://github.com/expressjs/multer NEWLINE https://github.com/expressjs/multer/commit/35a3272b611945155e046dd5cef11088587635e9 NEWLINE https://github.com/expressjs/multer/issues/1233 NEWLINE https://github.com/expressjs/multer/pull/1256 NEWLINE https://github.com/expressjs/multer/security/advisories/GHSA-g5hg-p3ph-g8qg NEWLINE https://nvd.nist.gov/vuln/detail/CVE-2025-48997 NEWLINE https://www.cve.org/CVERecord?id=CVE-2025-48997,Admin User (admin),1,,,False,,,,,,,High,,1,30,29,2026-05-12,2026-05-12,,,,True,,Trivy Scan,18,0,CVE-2025-48997 Multer 1.4.5-lts.2,False,False,,2026-04-12 12:35:37.003051+00:00,,True,,,,Trivy Scan,3,Labs Security Testing Final,1,Juice Shop,,CVE-2025-48997,lang-pkgs; node-pkg,"Active, Verified",
,,True,0,[],multer,1.4.5-lts.2,2026-04-12 12:35:37.012387+00:00,CVSS:3.1/AV:N/AC:L/PR:N/UI:N/S:U/C:N/I:N/A:H,7.5,,,248,2026-04-12,,,"multer: Multer Denial of Service NEWLINE **Target:** Node.js NEWLINE **Type:** node-pkg NEWLINE **Fixed version:** 2.0.2 NEWLINE  NEWLINE Multer is a node.js middleware for handling `multipart/form-data`. A vulnerability that is present starting in version 1.4.4-lts.1 and prior to version 2.0.2 allows an attacker to trigger a Denial of Service (DoS) by sending a malformed multi-part upload request. This request causes an unhandled exception, leading to a crash of the process. Users should upgrade to version 2.0.2 to receive a patch. No known workarounds are available. NEWLINE ",False,,,False,,,,False,juice-shop/node_modules/multer/package.json,,True,,True,False,,False,,33b43b94f6fc1e88bef206211995c8a1beec0c7191fa649e7364a8811dfdd380,763,fixed,False,,False,2026-04-12 12:35:36.239086+00:00,Admin User (admin),1,2026-04-12 12:35:37.012438+00:00,,,,,0,[],2.0.2,,S1,False,,,,,,,,False,https://access.redhat.com/security/cve/CVE-2025-7338 NEWLINE https://cna.openjsf.org/security-advisories.html NEWLINE https://github.com/expressjs/multer NEWLINE https://github.com/expressjs/multer/commit/adfeaf669f0e7fe953eab191a762164a452d143b NEWLINE https://github.com/expressjs/multer/security/advisories/GHSA-fjgf-rc76-4x9p NEWLINE https://nvd.nist.gov/vuln/detail/CVE-2025-7338 NEWLINE https://www.cve.org/CVERecord?id=CVE-2025-7338,Admin User (admin),1,,,False,,,,,,,High,,1,30,29,2026-05-12,2026-05-12,,,,True,,Trivy Scan,18,0,CVE-2025-7338 Multer 1.4.5-lts.2,False,False,,2026-04-12 12:35:37.012393+00:00,,True,,,,Trivy Scan,3,Labs Security Testing Final,1,Juice Shop,,CVE-2025-7338,lang-pkgs; node-pkg,"Active, Verified",
,,True,0,[],qs,6.13.0,2026-04-12 12:35:37.026466+00:00,,,CVSS:4.0/AV:N/AC:L/AT:N/PR:N/UI:N/VC:N/VI:N/VA:H/SC:N/SI:N/SA:N,8.7,20,2026-04-12,,,"qs: qs: Denial of Service via improper input validation in array parsing NEWLINE **Target:** Node.js NEWLINE **Type:** node-pkg NEWLINE **Fixed version:** 6.14.1 NEWLINE  NEWLINE Improper Input Validation vulnerability in qs (parse modules) allows HTTP DoS.This issue affects qs: < 6.14.1. NEWLINE  NEWLINE  NEWLINE Summary NEWLINE  NEWLINE The arrayLimit option in qs did not enforce limits for bracket notation (a[]=1&a[]=2), only for indexed notation (a[0]=1). This is a consistency bug; arrayLimit should apply uniformly across all array notations. NEWLINE  NEWLINE Note: The default parameterLimit of 1000 effectively mitigates the DoS scenario originally described. With default options, bracket notation cannot produce arrays larger than parameterLimit regardless of arrayLimit, because each a[]=valueconsumes one parameter slot. The severity has been reduced accordingly. NEWLINE  NEWLINE Details NEWLINE  NEWLINE The arrayLimit option only checked limits for indexed notation (a[0]=1&a[1]=2) but did not enforce it for bracket notation (a[]=1&a[]=2). NEWLINE  NEWLINE Vulnerable code (lib/parse.js:159-162): NEWLINE  NEWLINE if (root === '[]' && options.parseArrays) { NEWLINE     obj = utils.combine([], leaf);  // No arrayLimit check NEWLINE } NEWLINE  NEWLINE  NEWLINE  NEWLINE  NEWLINE  NEWLINE Working code (lib/parse.js:175): NEWLINE  NEWLINE else if (index <= options.arrayLimit) {  // Limit checked here NEWLINE     obj = []; NEWLINE     obj[index] = leaf; NEWLINE } NEWLINE  NEWLINE  NEWLINE  NEWLINE  NEWLINE  NEWLINE The bracket notation handler at line 159 uses utils.combine([], leaf) without validating against options.arrayLimit, while indexed notation at line 175 checks index <= options.arrayLimit before creating arrays. NEWLINE  NEWLINE  NEWLINE  NEWLINE PoC NEWLINE  NEWLINE const qs = require('qs'); NEWLINE const result = qs.parse('a[]=1&a[]=2&a[]=3&a[]=4&a[]=5&a[]=6', { arrayLimit: 5 }); NEWLINE console.log(result.a.length);  // Output: 6 (should be max 5) NEWLINE  NEWLINE  NEWLINE  NEWLINE  NEWLINE  NEWLINE Note on parameterLimit interaction: The original advisory's ""DoS demonstration"" claimed a length of 10,000, but parameterLimit (default: 1000) caps parsing to 1,000 parameters. With default options, the actual output is 1,000, not 10,000. NEWLINE  NEWLINE Impact NEWLINE  NEWLINE Consistency bug in arrayLimit enforcement. With default parameterLimit, the practical DoS risk is negligible since parameterLimit already caps the total number of parsed parameters (and thus array elements from bracket notation). The risk increases only when parameterLimit is explicitly set to a very high value. NEWLINE ",False,,,False,,,,False,juice-shop/node_modules/qs/package.json,,True,,True,False,,False,,53036ea91ce237bcc79330aa2a3bd161d155731d122ef1915600f90b7f82d9cb,765,fixed,False,,False,2026-04-12 12:35:36.239086+00:00,Admin User (admin),1,2026-04-12 12:35:37.026519+00:00,,,,,0,[],6.14.1,,S1,False,,,,,,,,False,https://access.redhat.com/security/cve/CVE-2025-15284 NEWLINE https://github.com/ljharb/qs NEWLINE https://github.com/ljharb/qs/commit/3086902ecf7f088d0d1803887643ac6c03d415b9 NEWLINE https://github.com/ljharb/qs/security/advisories/GHSA-6rw7-vpxm-498p NEWLINE https://nvd.nist.gov/vuln/detail/CVE-2025-15284 NEWLINE https://www.cve.org/CVERecord?id=CVE-2025-15284,Admin User (admin),1,,,False,,,,,,,High,,1,30,29,2026-05-12,2026-05-12,,,,True,,Trivy Scan,18,0,CVE-2025-15284 Qs 6.13.0,False,False,,2026-04-12 12:35:37.026474+00:00,,True,,,,Trivy Scan,3,Labs Security Testing Final,1,Juice Shop,,CVE-2025-15284,lang-pkgs; node-pkg,"Active, Verified",
,,True,0,[],sanitize-html,1.4.2,2026-04-12 12:35:37.041635+00:00,CVSS:3.1/AV:N/AC:L/PR:N/UI:N/S:U/C:N/I:N/A:H,7.5,,,1333,2026-04-12,,,sanitize-html: insecure global regular expression replacement logic may lead to ReDoS NEWLINE **Target:** Node.js NEWLINE **Type:** node-pkg NEWLINE **Fixed version:** 2.7.1 NEWLINE  NEWLINE The package sanitize-html before 2.7.1 are vulnerable to Regular Expression Denial of Service (ReDoS) due to insecure global regular expression replacement logic of HTML comment removal. NEWLINE ,False,,,False,,,,False,juice-shop/node_modules/sanitize-html/package.json,,True,,True,False,,False,,5336cfa12cf3900d3fb926e6a85d22a47c2bc12db14156286dbfe08c9a3b5e82,767,fixed,False,,False,2026-04-12 12:35:36.239086+00:00,Admin User (admin),1,2026-04-12 12:35:37.041681+00:00,,,,,0,[],2.7.1,,S1,False,,,,,,,,False,https://access.redhat.com/security/cve/CVE-2022-25887 NEWLINE https://github.com/apostrophecms/sanitize-html/commit/b4682c12fd30e12e82fa2d9b766de91d7d2cd23c NEWLINE https://github.com/apostrophecms/sanitize-html/pull/557 NEWLINE https://nvd.nist.gov/vuln/detail/CVE-2022-25887 NEWLINE https://security.snyk.io/vuln/SNYK-JAVA-ORGWEBJARSNPM-3008102 NEWLINE https://security.snyk.io/vuln/SNYK-JS-SANITIZEHTML-2957526 NEWLINE https://ubuntu.com/security/notices/USN-7464-1 NEWLINE https://www.cve.org/CVERecord?id=CVE-2022-25887,Admin User (admin),1,,,False,,,,,,,High,,1,30,29,2026-05-12,2026-05-12,,,,True,,Trivy Scan,18,0,CVE-2022-25887 Sanitize-HTML 1.4.2,False,False,,2026-04-12 12:35:37.041642+00:00,,True,,,,Trivy Scan,3,Labs Security Testing Final,1,Juice Shop,,CVE-2022-25887,lang-pkgs; node-pkg,"Active, Verified",
,,True,0,[],tar,4.4.19,2026-04-12 12:35:37.128057+00:00,,,CVSS:4.0/AV:L/AC:L/AT:N/PR:N/UI:A/VC:H/VI:L/VA:N/SC:H/SI:L/SA:N,8.2,22,2026-04-12,,,"node-tar: tar: node-tar: Arbitrary file overwrite and symlink poisoning via unsanitized linkpaths in archives NEWLINE **Target:** Node.js NEWLINE **Type:** node-pkg NEWLINE **Fixed version:** 7.5.3 NEWLINE  NEWLINE node-tar is a Tar for Node.js. The node-tar library (<= 7.5.2) fails to sanitize the linkpath of Link (hardlink) and SymbolicLink entries when preservePaths is false (the default secure behavior). This allows malicious archives to bypass the extraction root restriction, leading to Arbitrary File Overwrite via hardlinks and Symlink Poisoning via absolute symlink targets. This vulnerability is fixed in 7.5.3. NEWLINE ",False,,,False,,,,False,juice-shop/node_modules/node-pre-gyp/node_modules/tar/package.json,,True,,True,False,,False,,d15611f52a7c1ebace4796e595cbd4bd9cd55de60bd9c2e03251d4200e3b6474,777,fixed,False,,False,2026-04-12 12:35:36.239086+00:00,Admin User (admin),1,2026-04-12 12:35:37.128102+00:00,,,,,0,[],7.5.3,,S1,False,,,,,,,,False,https://access.redhat.com/security/cve/CVE-2026-23745 NEWLINE https://github.com/isaacs/node-tar NEWLINE https://github.com/isaacs/node-tar/commit/340eb285b6d986e91969a1170d7fe9b0face405e NEWLINE https://github.com/isaacs/node-tar/security/advisories/GHSA-8qq5-rm4j-mr97 NEWLINE https://nvd.nist.gov/vuln/detail/CVE-2026-23745 NEWLINE https://www.cve.org/CVERecord?id=CVE-2026-23745,Admin User (admin),1,,,False,,,,,,,High,,1,30,29,2026-05-12,2026-05-12,,,,True,,Trivy Scan,18,0,CVE-2026-23745 Tar 4.4.19,False,False,,2026-04-12 12:35:37.128063+00:00,,True,,,,Trivy Scan,3,Labs Security Testing Final,1,Juice Shop,,CVE-2026-23745,lang-pkgs; node-pkg,"Active, Verified",
,,True,0,[],tar,4.4.19,2026-04-12 12:35:37.135441+00:00,CVSS:3.1/AV:N/AC:L/PR:N/UI:R/S:C/C:L/I:H/A:L,8.8,,,176,2026-04-12,,,"node-tar: tar: node-tar: Arbitrary file overwrite via Unicode path collision race condition NEWLINE **Target:** Node.js NEWLINE **Type:** node-pkg NEWLINE **Fixed version:** 7.5.4 NEWLINE  NEWLINE node-tar,a Tar for Node.js, has a race condition vulnerability in versions up to and including 7.5.3. This is due to an incomplete handling of Unicode path collisions in the `path-reservations` system. On case-insensitive or normalization-insensitive filesystems (such as macOS APFS, In which it has been tested), the library fails to lock colliding paths (e.g., `ß` and `ss`), allowing them to be processed in parallel. This bypasses the library's internal concurrency safeguards and permits Symlink Poisoning attacks via race conditions. The library uses a `PathReservations` system to ensure that metadata checks and file operations for the same path are serialized. This prevents race conditions where one entry might clobber another concurrently. This is a Race Condition which enables Arbitrary File Overwrite. This vulnerability affects users and systems using node-tar on macOS (APFS/HFS+). Because of using `NFD` Unicode normalization (in which `ß` and `ss` are different), conflicting paths do not have their order properly preserved under filesystems that ignore Unicode normalization (e.g., APFS (in which `ß` causes an inode collision with `ss`)). This enables an attacker to circumvent internal parallelization locks (`PathReservations`) using conflicting filenames within a malicious tar archive. The patch in version 7.5.4 updates `path-reservations.js` to use a normalization form that matches the target filesystem's behavior (e.g., `NFKD`), followed by first `toLocaleLowerCase('en')` and then `toLocaleUpperCase('en')`. As a workaround, users who cannot upgrade promptly, and who are programmatically using `node-tar` to extract arbitrary tarball data should filter out all `SymbolicLink` entries (as npm does) to defend against arbitrary file writes via this file system entry name collision issue. NEWLINE ",False,,,False,,,,False,juice-shop/node_modules/node-pre-gyp/node_modules/tar/package.json,,True,,True,False,,False,,f5ea7b3070fbaafc39f8219cc94627b72c3b534b472f2306332161b459a9b7a9,778,fixed,False,,False,2026-04-12 12:35:36.239086+00:00,Admin User (admin),1,2026-04-12 12:35:37.135488+00:00,,,,,0,[],7.5.4,,S1,False,,,,,,,,False,https://access.redhat.com/security/cve/CVE-2026-23950 NEWLINE https://github.com/isaacs/node-tar NEWLINE https://github.com/isaacs/node-tar/commit/3b1abfae650056edfabcbe0a0df5954d390521e6 NEWLINE https://github.com/isaacs/node-tar/security/advisories/GHSA-r6q2-hw4h-h46w NEWLINE https://nvd.nist.gov/vuln/detail/CVE-2026-23950 NEWLINE https://www.cve.org/CVERecord?id=CVE-2026-23950,Admin User (admin),1,,,False,,,,,,,High,,1,30,29,2026-05-12,2026-05-12,,,,True,,Trivy Scan,18,0,CVE-2026-23950 Tar 4.4.19,False,False,,2026-04-12 12:35:37.135447+00:00,,True,,,,Trivy Scan,3,Labs Security Testing Final,1,Juice Shop,,CVE-2026-23950,lang-pkgs; node-pkg,"Active, Verified",
,,True,0,[],tar,4.4.19,2026-04-12 12:35:37.142343+00:00,CVSS:3.1/AV:N/AC:L/PR:N/UI:R/S:C/C:H/I:L/A:N,8.2,,,22,2026-04-12,,,"node-tar: tar: node-tar: Arbitrary file creation via path traversal bypass in hardlink security check NEWLINE **Target:** Node.js NEWLINE **Type:** node-pkg NEWLINE **Fixed version:** 7.5.7 NEWLINE  NEWLINE node-tar,a Tar for Node.js, contains a vulnerability in versions prior to 7.5.7 where the security check for hardlink entries uses different path resolution semantics than the actual hardlink creation logic. This mismatch allows an attacker to craft a malicious TAR archive that bypasses path traversal protections and creates hardlinks to arbitrary files outside the extraction directory. Version 7.5.7 contains a fix for the issue. NEWLINE ",False,,,False,,,,False,juice-shop/node_modules/node-pre-gyp/node_modules/tar/package.json,,True,,True,False,,False,,b78954509e5a2b1f814397b776a31927a0736a3aa1ef831a04d733fce704cf78,779,fixed,False,,False,2026-04-12 12:35:36.239086+00:00,Admin User (admin),1,2026-04-12 12:35:37.142388+00:00,,,,,0,[],7.5.7,,S1,False,,,,,,,,False,https://access.redhat.com/security/cve/CVE-2026-24842 NEWLINE https://github.com/isaacs/node-tar NEWLINE https://github.com/isaacs/node-tar/commit/f4a7aa9bc3d717c987fdf1480ff7a64e87ffdb46 NEWLINE https://github.com/isaacs/node-tar/security/advisories/GHSA-34x7-hfp2-rc4v NEWLINE https://nvd.nist.gov/vuln/detail/CVE-2026-24842 NEWLINE https://www.cve.org/CVERecord?id=CVE-2026-24842,Admin User (admin),1,,,False,,,,,,,High,,1,30,29,2026-05-12,2026-05-12,,,,True,,Trivy Scan,18,0,CVE-2026-24842 Tar 4.4.19,False,False,,2026-04-12 12:35:37.142349+00:00,,True,,,,Trivy Scan,3,Labs Security Testing Final,1,Juice Shop,,CVE-2026-24842,lang-pkgs; node-pkg,"Active, Verified",
,,True,0,[],tar,4.4.19,2026-04-12 12:35:37.148880+00:00,CVSS:3.1/AV:L/AC:L/PR:N/UI:R/S:U/C:H/I:H/A:N,7.1,,,22,2026-04-12,,,"tar: node-tar: node-tar: Arbitrary file read/write via malicious archive hardlink creation NEWLINE **Target:** Node.js NEWLINE **Type:** node-pkg NEWLINE **Fixed version:** 7.5.8 NEWLINE  NEWLINE node-tar is a full-featured Tar for Node.js. When using default options in versions 7.5.7 and below, an attacker-controlled archive can create a hardlink inside the extraction directory that points to a file outside the extraction root, enabling arbitrary file read and write as the extracting user. Severity is high because the primitive bypasses path protections and turns archive extraction into a direct filesystem access primitive. This issue has been fixed in version 7.5.8. NEWLINE ",False,,,False,,,,False,juice-shop/node_modules/node-pre-gyp/node_modules/tar/package.json,,True,,True,False,,False,,3969e5dc9ff457448beff5854b50b2941e3bafb8204307196a0746884df2c806,780,fixed,False,,False,2026-04-12 12:35:36.239086+00:00,Admin User (admin),1,2026-04-12 12:35:37.148920+00:00,,,,,0,[],7.5.8,,S1,False,,,,,,,,False,https://access.redhat.com/security/cve/CVE-2026-26960 NEWLINE https://github.com/isaacs/node-tar NEWLINE https://github.com/isaacs/node-tar/commit/2cb1120bcefe28d7ecc719b41441ade59c52e384 NEWLINE https://github.com/isaacs/node-tar/commit/d18e4e1f846f4ddddc153b0f536a19c050e7499f NEWLINE https://github.com/isaacs/node-tar/security/advisories/GHSA-83g3-92jg-28cx NEWLINE https://nvd.nist.gov/vuln/detail/CVE-2026-26960 NEWLINE https://www.cve.org/CVERecord?id=CVE-2026-26960,Admin User (admin),1,,,False,,,,,,,High,,1,30,29,2026-05-12,2026-05-12,,,,True,,Trivy Scan,18,0,CVE-2026-26960 Tar 4.4.19,False,False,,2026-04-12 12:35:37.148885+00:00,,True,,,,Trivy Scan,3,Labs Security Testing Final,1,Juice Shop,,CVE-2026-26960,lang-pkgs; node-pkg,"Active, Verified",
,,True,0,[],tar,6.2.1,2026-04-12 12:35:37.163624+00:00,,,CVSS:4.0/AV:L/AC:L/AT:N/PR:N/UI:A/VC:H/VI:L/VA:N/SC:H/SI:L/SA:N,8.2,22,2026-04-12,,,"node-tar: tar: node-tar: Arbitrary file overwrite and symlink poisoning via unsanitized linkpaths in archives NEWLINE **Target:** Node.js NEWLINE **Type:** node-pkg NEWLINE **Fixed version:** 7.5.3 NEWLINE  NEWLINE node-tar is a Tar for Node.js. The node-tar library (<= 7.5.2) fails to sanitize the linkpath of Link (hardlink) and SymbolicLink entries when preservePaths is false (the default secure behavior). This allows malicious archives to bypass the extraction root restriction, leading to Arbitrary File Overwrite via hardlinks and Symlink Poisoning via absolute symlink targets. This vulnerability is fixed in 7.5.3. NEWLINE ",False,,,False,,,,False,juice-shop/node_modules/sqlite3/node_modules/tar/package.json,,True,,True,False,,False,,76cb194d7dc1b333dfa33d886d518de5e5f47410f30aebb9ccfdc7d9a9ce59f4,782,fixed,False,,False,2026-04-12 12:35:36.239086+00:00,Admin User (admin),1,2026-04-12 12:35:37.163671+00:00,,,,,0,[],7.5.3,,S1,False,,,,,,,,False,https://access.redhat.com/security/cve/CVE-2026-23745 NEWLINE https://github.com/isaacs/node-tar NEWLINE https://github.com/isaacs/node-tar/commit/340eb285b6d986e91969a1170d7fe9b0face405e NEWLINE https://github.com/isaacs/node-tar/security/advisories/GHSA-8qq5-rm4j-mr97 NEWLINE https://nvd.nist.gov/vuln/detail/CVE-2026-23745 NEWLINE https://www.cve.org/CVERecord?id=CVE-2026-23745,Admin User (admin),1,,,False,,,,,,,High,,1,30,29,2026-05-12,2026-05-12,,,,True,,Trivy Scan,18,0,CVE-2026-23745 Tar 6.2.1,False,False,,2026-04-12 12:35:37.163630+00:00,,True,,,,Trivy Scan,3,Labs Security Testing Final,1,Juice Shop,,CVE-2026-23745,lang-pkgs; node-pkg,"Active, Verified",
