,,True,0,[],libc6,2.36-9+deb12u10,2026-04-12 12:35:36.362257+00:00,CVSS:3.1/AV:L/AC:H/PR:L/UI:R/S:U/C:L/I:L/A:L,4.2,,,415,2026-04-12,,,glibc: Double free in glibc NEWLINE **Target:** bkimminich/juice-shop:v19.0.0 (debian 12.11) NEWLINE **Type:** debian NEWLINE **Fixed version:** 2.36-9+deb12u13 NEWLINE  NEWLINE The regcomp function in the GNU C library version from 2.4 to 2.41 is  NEWLINE subject to a double free if some previous allocation fails. It can be  NEWLINE accomplished either by a malloc failure or by using an interposed malloc NEWLINE  that injects random malloc failures. The double free can allow buffer  NEWLINE manipulation depending of how the regex is constructed. This issue  NEWLINE affects all architectures and ABIs supported by the GNU C library. NEWLINE ,False,,,False,,,,False,bkimminich/juice-shop:v19.0.0 (debian 12.11),,True,,True,False,,False,,026ce1932d3f687fa4d9907b8f0a2e2540c18b3be4bdd886dcd32510e996db12,687,fixed,False,,False,2026-04-12 12:35:36.239086+00:00,Admin User (admin),1,2026-04-12 12:35:36.362307+00:00,,,,,0,[],2.36-9+deb12u13,,S2,False,,,,,,,,False,http://www.openwall.com/lists/oss-security/2025/07/23/1 NEWLINE https://access.redhat.com/errata/RHSA-2025:12980 NEWLINE https://access.redhat.com/security/cve/CVE-2025-8058 NEWLINE https://bugzilla.redhat.com/2383146 NEWLINE https://bugzilla.redhat.com/show_bug.cgi?id=2383146 NEWLINE https://cve.mitre.org/cgi-bin/cvename.cgi?name=CVE-2025-8058 NEWLINE https://errata.almalinux.org/8/ALSA-2025-12980.html NEWLINE https://errata.rockylinux.org/RLSA-2025:12748 NEWLINE https://linux.oracle.com/cve/CVE-2025-8058.html NEWLINE https://linux.oracle.com/errata/ELSA-2025-28054.html NEWLINE https://nvd.nist.gov/vuln/detail/CVE-2025-8058 NEWLINE https://sourceware.org/bugzilla/show_bug.cgi?id=33185 NEWLINE https://sourceware.org/git/?p=glibc.git;a=blob_plain;f=advisories/GLIBC-SA-2025-0005 NEWLINE https://sourceware.org/git/?p=glibc.git;a=commit;h=3ff17af18c38727b88d9115e536c069e6b5d601f NEWLINE https://ubuntu.com/security/notices/USN-7760-1 NEWLINE https://ubuntu.com/security/notices/USN-8005-1 NEWLINE https://www.cve.org/CVERecord?id=CVE-2025-8058,Admin User (admin),1,,,False,,,,,,,Medium,,1,90,89,2026-07-11,2026-07-11,,,,True,,Trivy Scan,18,0,CVE-2025-8058 Libc6 2.36-9+deb12u10,False,False,,2026-04-12 12:35:36.362265+00:00,,True,,,,Trivy Scan,3,Labs Security Testing Final,1,Juice Shop,,CVE-2025-8058,debian; os-pkgs,"Active, Verified",
,,True,0,[],js-yaml,3.14.1,2026-04-12 12:35:38.084798+00:00,CVSS:3.1/AV:N/AC:L/PR:N/UI:N/S:U/C:N/I:L/A:N,5.3,,,0,2026-04-12,,,"**Vulnerability Namespace:** github:language:javascript NEWLINE **Vulnerability Description:** js-yaml has prototype pollution in merge (<<) NEWLINE **Related Vulnerability Description:** js-yaml is a JavaScript YAML parser and dumper. In js-yaml before 4.1.1 and 3.14.2, it's possible for an attacker to modify the prototype of the result of a parsed yaml document via prototype pollution (`__proto__`). All users who parse untrusted yaml documents may be impacted. The problem is patched in js-yaml 4.1.1 and 3.14.2. Users can protect against this kind of attack on the server by using `node --disable-proto=delete` or `deno` (in Deno, pollution protection is on by default). NEWLINE **Matcher:** javascript-matcher NEWLINE **Package URL:** pkg:npm/js-yaml@3.14.1",False,,,False,,0.04961,0.0002,False,/juice-shop/node_modules/js-yaml/package.json,,True,3.14.2,True,False,,False,,8e34089d9d95f1ccab572d75c98bf8d4d95a2cf9d0cd2df8446adc4849d7dda2,881,,False,,False,2026-04-12 12:35:37.658338+00:00,Admin User (admin),1,2026-04-12 12:35:38.084845+00:00,,,,,0,[],Upgrade to version: 3.14.2,1,S2,False,,,,,,,,False,**Vulnerability Datasource:** https://github.com/advisories/GHSA-mh29-5h37-fv8m NEWLINE **Vulnerability URLs:** NEWLINE - https://github.com/nodeca/js-yaml/security/advisories/GHSA-mh29-5h37-fv8m NEWLINE - https://nvd.nist.gov/vuln/detail/CVE-2025-64718 NEWLINE - https://github.com/nodeca/js-yaml/commit/383665ff4248ec2192d1274e934462bb30426879 NEWLINE - https://github.com/nodeca/js-yaml/commit/5278870a17454fe8621dbd8c445c412529525266 NEWLINE - https://github.com/nodeca/js-yaml/issues/730#issuecomment-3549635876 NEWLINE **Related Vulnerability Datasource:** https://nvd.nist.gov/vuln/detail/CVE-2025-64718 NEWLINE **Related Vulnerability URLs:** NEWLINE - https://github.com/nodeca/js-yaml/commit/383665ff4248ec2192d1274e934462bb30426879 NEWLINE - https://github.com/nodeca/js-yaml/commit/5278870a17454fe8621dbd8c445c412529525266 NEWLINE - https://github.com/nodeca/js-yaml/issues/730#issuecomment-3549635876 NEWLINE - https://github.com/nodeca/js-yaml/security/advisories/GHSA-mh29-5h37-fv8m,Admin User (admin),1,,,False,,,,,,,Medium,,1,90,89,2026-07-11,2026-07-11,,,,True,,Anchore Grype,20,0,GHSA-mh29-5h37-fv8m in js-yaml:3.14.1,False,False,,2026-04-12 12:35:38.084805+00:00,,False,,GHSA-mh29-5h37-fv8m,,Anchore Grype,3,Labs Security Testing Final,1,Juice Shop,,GHSA-mh29-5h37-fv8m; CVE-2025-64718,,Active,
,,True,0,[],libssl3,3.0.17-1~deb12u2,2026-04-12 12:35:36.471990+00:00,CVSS:3.1/AV:L/AC:H/PR:L/UI:N/S:U/C:N/I:N/A:H,4.7,,,787,2026-04-12,,,"openssl: OpenSSL: Denial of Service due to out-of-bounds write in BIO filter NEWLINE **Target:** bkimminich/juice-shop:v19.0.0 (debian 12.11) NEWLINE **Type:** debian NEWLINE **Fixed version:** 3.0.18-1~deb12u2 NEWLINE  NEWLINE Issue summary: Writing large, newline-free data into a BIO chain using the NEWLINE line-buffering filter where the next BIO performs short writes can trigger NEWLINE a heap-based out-of-bounds write. NEWLINE  NEWLINE Impact summary: This out-of-bounds write can cause memory corruption which NEWLINE typically results in a crash, leading to Denial of Service for an application. NEWLINE  NEWLINE The line-buffering BIO filter (BIO_f_linebuffer) is not used by default in NEWLINE TLS/SSL data paths. In OpenSSL command-line applications, it is typically NEWLINE only pushed onto stdout/stderr on VMS systems. Third-party applications that NEWLINE explicitly use this filter with a BIO chain that can short-write and that NEWLINE write large, newline-free data influenced by an attacker would be affected. NEWLINE However, the circumstances where this could happen are unlikely to be under NEWLINE attacker control, and BIO_f_linebuffer is unlikely to be handling non-curated NEWLINE data controlled by an attacker. For that reason the issue was assessed as NEWLINE Low severity. NEWLINE  NEWLINE The FIPS modules in 3.6, 3.5, 3.4, 3.3 and 3.0 are not affected by this issue, NEWLINE as the BIO implementation is outside the OpenSSL FIPS module boundary. NEWLINE  NEWLINE OpenSSL 3.6, 3.5, 3.4, 3.3, 3.0, 1.1.1 and 1.0.2 are vulnerable to this issue. NEWLINE ",False,,,False,,,,False,bkimminich/juice-shop:v19.0.0 (debian 12.11),,True,,True,False,,False,,1aff0f4c4bcc34070859fdf2eb6b67b7a7e53c2e42b8c83e4cbc5b1e086807c4,701,fixed,False,,False,2026-04-12 12:35:36.239086+00:00,Admin User (admin),1,2026-04-12 12:35:36.472050+00:00,,,,,0,[],3.0.18-1~deb12u2,,S2,False,,,,,,,,False,https://access.redhat.com/errata/RHSA-2026:1473 NEWLINE https://access.redhat.com/security/cve/CVE-2025-68160 NEWLINE https://bugzilla.redhat.com/2430375 NEWLINE https://bugzilla.redhat.com/2430376 NEWLINE https://bugzilla.redhat.com/2430377 NEWLINE https://bugzilla.redhat.com/2430378 NEWLINE https://bugzilla.redhat.com/2430379 NEWLINE https://bugzilla.redhat.com/2430380 NEWLINE https://bugzilla.redhat.com/2430381 NEWLINE https://bugzilla.redhat.com/2430386 NEWLINE https://bugzilla.redhat.com/2430387 NEWLINE https://bugzilla.redhat.com/2430388 NEWLINE https://bugzilla.redhat.com/2430389 NEWLINE https://bugzilla.redhat.com/2430390 NEWLINE https://bugzilla.redhat.com/show_bug.cgi?id=2430375 NEWLINE https://bugzilla.redhat.com/show_bug.cgi?id=2430376 NEWLINE https://bugzilla.redhat.com/show_bug.cgi?id=2430377 NEWLINE https://bugzilla.redhat.com/show_bug.cgi?id=2430378 NEWLINE https://bugzilla.redhat.com/show_bug.cgi?id=2430379 NEWLINE https://bugzilla.redhat.com/show_bug.cgi?id=2430380 NEWLINE https://bugzilla.redhat.com/show_bug.cgi?id=2430381 NEWLINE https://bugzilla.redhat.com/show_bug.cgi?id=2430386 NEWLINE https://bugzilla.redhat.com/show_bug.cgi?id=2430387 NEWLINE https://bugzilla.redhat.com/show_bug.cgi?id=2430388 NEWLINE https://bugzilla.redhat.com/show_bug.cgi?id=2430389 NEWLINE https://bugzilla.redhat.com/show_bug.cgi?id=2430390 NEWLINE https://cve.mitre.org/cgi-bin/cvename.cgi?name=CVE-2025-11187 NEWLINE https://cve.mitre.org/cgi-bin/cvename.cgi?name=CVE-2025-15467 NEWLINE https://cve.mitre.org/cgi-bin/cvename.cgi?name=CVE-2025-15468 NEWLINE https://cve.mitre.org/cgi-bin/cvename.cgi?name=CVE-2025-15469 NEWLINE https://cve.mitre.org/cgi-bin/cvename.cgi?name=CVE-2025-66199 NEWLINE https://cve.mitre.org/cgi-bin/cvename.cgi?name=CVE-2025-68160 NEWLINE https://cve.mitre.org/cgi-bin/cvename.cgi?name=CVE-2025-69418 NEWLINE https://cve.mitre.org/cgi-bin/cvename.cgi?name=CVE-2025-69419 NEWLINE https://cve.mitre.org/cgi-bin/cvename.cgi?name=CVE-2025-69420 NEWLINE https://cve.mitre.org/cgi-bin/cvename.cgi?name=CVE-2025-69421 NEWLINE https://cve.mitre.org/cgi-bin/cvename.cgi?name=CVE-2026-22795 NEWLINE https://cve.mitre.org/cgi-bin/cvename.cgi?name=CVE-2026-22796 NEWLINE https://errata.almalinux.org/9/ALSA-2026-1473.html NEWLINE https://errata.rockylinux.org/RLSA-2026:1473 NEWLINE https://github.com/openssl/openssl/commit/384011202af92605d926fafe4a0bcd6b65d162ad NEWLINE https://github.com/openssl/openssl/commit/475c466ef2fbd8fc1df6fae1c3eed9c813fc8ff6 NEWLINE https://github.com/openssl/openssl/commit/4c96fbba618e1940f038012506ee9e21d32ee12c NEWLINE https://github.com/openssl/openssl/commit/6845c3b6460a98b1ec4e463baa2ea1a63a32d7c0 NEWLINE https://github.com/openssl/openssl/commit/68a7cd2e2816c3a02f4d45a2ce43fc04fac97096 NEWLINE https://linux.oracle.com/cve/CVE-2025-68160.html NEWLINE https://linux.oracle.com/errata/ELSA-2026-50081.html NEWLINE https://nvd.nist.gov/vuln/detail/CVE-2025-68160 NEWLINE https://openssl-library.org/news/secadv/20260127.txt NEWLINE https://ubuntu.com/security/notices/USN-7980-1 NEWLINE https://ubuntu.com/security/notices/USN-7980-2 NEWLINE https://www.cve.org/CVERecord?id=CVE-2025-68160,Admin User (admin),1,,,False,,,,,,,Medium,,1,90,89,2026-07-11,2026-07-11,,,,True,,Trivy Scan,18,0,CVE-2025-68160 Libssl3 3.0.17-1~deb12u2,False,False,,2026-04-12 12:35:36.471995+00:00,,True,,,,Trivy Scan,3,Labs Security Testing Final,1,Juice Shop,,CVE-2025-68160,debian; os-pkgs,"Active, Verified",
,,True,0,[],libssl3,3.0.17-1~deb12u2,2026-04-12 12:35:36.479244+00:00,CVSS:3.1/AV:L/AC:H/PR:N/UI:N/S:U/C:L/I:L/A:N,4.0,,,325,2026-04-12,,,"openssl: OpenSSL: Information disclosure and data tampering via specific low-level OCB encryption/decryption calls NEWLINE **Target:** bkimminich/juice-shop:v19.0.0 (debian 12.11) NEWLINE **Type:** debian NEWLINE **Fixed version:** 3.0.18-1~deb12u2 NEWLINE  NEWLINE Issue summary: When using the low-level OCB API directly with AES-NI or<br>other hardware-accelerated code paths, inputs whose length is not a multiple<br>of 16 bytes can leave the final partial block unencrypted and unauthenticated.<br><br>Impact summary: The trailing 1-15 bytes of a message may be exposed in<br>cleartext on encryption and are not covered by the authentication tag,<br>allowing an attacker to read or tamper with those bytes without detection.<br><br>The low-level OCB encrypt and decrypt routines in the hardware-accelerated<br>stream path process full 16-byte blocks but do not advance the input/output<br>pointers. The subsequent tail-handling code then operates on the original<br>base pointers, effectively reprocessing the beginning of the buffer while<br>leaving the actual trailing bytes unprocessed. The authentication checksum<br>also excludes the true tail bytes.<br><br>However, typical OpenSSL consumers using EVP are not affected because the<br>higher-level EVP and provider OCB implementations split inputs so that full<br>blocks and trailing partial blocks are processed in separate calls, avoiding<br>the problematic code path. Additionally, TLS does not use OCB ciphersuites.<br>The vulnerability only affects applications that call the low-level<br>CRYPTO_ocb128_encrypt() or CRYPTO_ocb128_decrypt() functions directly with<br>non-block-aligned lengths in a single call on hardware-accelerated builds.<br>For these reasons the issue was assessed as Low severity.<br><br>The FIPS modules in 3.6, 3.5, 3.4, 3.3, 3.2, 3.1 and 3.0 are not affected<br>by this issue, as OCB mode is not a FIPS-approved algorithm.<br><br>OpenSSL 3.6, 3.5, 3.4, 3.3, 3.0 and 1.1.1 are vulnerable to this issue.<br><br>OpenSSL 1.0.2 is not affected by this issue. NEWLINE ",False,,,False,,,,False,bkimminich/juice-shop:v19.0.0 (debian 12.11),,True,,True,False,,False,,f9c6a8e432fe1ed82bc0d988f59064aa2fb2c645b9a8087005f7ba3e2ad61ef0,702,fixed,False,,False,2026-04-12 12:35:36.239086+00:00,Admin User (admin),1,2026-04-12 12:35:36.479326+00:00,,,,,0,[],3.0.18-1~deb12u2,,S2,False,,,,,,,,False,https://access.redhat.com/errata/RHSA-2026:1473 NEWLINE https://access.redhat.com/security/cve/CVE-2025-69418 NEWLINE https://bugzilla.redhat.com/2430375 NEWLINE https://bugzilla.redhat.com/2430376 NEWLINE https://bugzilla.redhat.com/2430377 NEWLINE https://bugzilla.redhat.com/2430378 NEWLINE https://bugzilla.redhat.com/2430379 NEWLINE https://bugzilla.redhat.com/2430380 NEWLINE https://bugzilla.redhat.com/2430381 NEWLINE https://bugzilla.redhat.com/2430386 NEWLINE https://bugzilla.redhat.com/2430387 NEWLINE https://bugzilla.redhat.com/2430388 NEWLINE https://bugzilla.redhat.com/2430389 NEWLINE https://bugzilla.redhat.com/2430390 NEWLINE https://bugzilla.redhat.com/show_bug.cgi?id=2430375 NEWLINE https://bugzilla.redhat.com/show_bug.cgi?id=2430376 NEWLINE https://bugzilla.redhat.com/show_bug.cgi?id=2430377 NEWLINE https://bugzilla.redhat.com/show_bug.cgi?id=2430378 NEWLINE https://bugzilla.redhat.com/show_bug.cgi?id=2430379 NEWLINE https://bugzilla.redhat.com/show_bug.cgi?id=2430380 NEWLINE https://bugzilla.redhat.com/show_bug.cgi?id=2430381 NEWLINE https://bugzilla.redhat.com/show_bug.cgi?id=2430386 NEWLINE https://bugzilla.redhat.com/show_bug.cgi?id=2430387 NEWLINE https://bugzilla.redhat.com/show_bug.cgi?id=2430388 NEWLINE https://bugzilla.redhat.com/show_bug.cgi?id=2430389 NEWLINE https://bugzilla.redhat.com/show_bug.cgi?id=2430390 NEWLINE https://cve.mitre.org/cgi-bin/cvename.cgi?name=CVE-2025-11187 NEWLINE https://cve.mitre.org/cgi-bin/cvename.cgi?name=CVE-2025-15467 NEWLINE https://cve.mitre.org/cgi-bin/cvename.cgi?name=CVE-2025-15468 NEWLINE https://cve.mitre.org/cgi-bin/cvename.cgi?name=CVE-2025-15469 NEWLINE https://cve.mitre.org/cgi-bin/cvename.cgi?name=CVE-2025-66199 NEWLINE https://cve.mitre.org/cgi-bin/cvename.cgi?name=CVE-2025-68160 NEWLINE https://cve.mitre.org/cgi-bin/cvename.cgi?name=CVE-2025-69418 NEWLINE https://cve.mitre.org/cgi-bin/cvename.cgi?name=CVE-2025-69419 NEWLINE https://cve.mitre.org/cgi-bin/cvename.cgi?name=CVE-2025-69420 NEWLINE https://cve.mitre.org/cgi-bin/cvename.cgi?name=CVE-2025-69421 NEWLINE https://cve.mitre.org/cgi-bin/cvename.cgi?name=CVE-2026-22795 NEWLINE https://cve.mitre.org/cgi-bin/cvename.cgi?name=CVE-2026-22796 NEWLINE https://errata.almalinux.org/9/ALSA-2026-1473.html NEWLINE https://errata.rockylinux.org/RLSA-2026:1473 NEWLINE https://github.com/openssl/openssl/commit/372fc5c77529695b05b4f5b5187691a57ef5dffc NEWLINE https://github.com/openssl/openssl/commit/4016975d4469cd6b94927c607f7c511385f928d8 NEWLINE https://github.com/openssl/openssl/commit/52d23c86a54adab5ee9f80e48b242b52c4cc2347 NEWLINE https://github.com/openssl/openssl/commit/a7589230356d908c0eca4b969ec4f62106f4f5ae NEWLINE https://github.com/openssl/openssl/commit/ed40856d7d4ba6cb42779b6770666a65f19cb977 NEWLINE https://linux.oracle.com/cve/CVE-2025-69418.html NEWLINE https://linux.oracle.com/errata/ELSA-2026-50081.html NEWLINE https://nvd.nist.gov/vuln/detail/CVE-2025-69418 NEWLINE https://openssl-library.org/news/secadv/20260127.txt NEWLINE https://ubuntu.com/security/notices/USN-7980-1 NEWLINE https://ubuntu.com/security/notices/USN-7980-2 NEWLINE https://www.cve.org/CVERecord?id=CVE-2025-69418,Admin User (admin),1,,,False,,,,,,,Medium,,1,90,89,2026-07-11,2026-07-11,,,,True,,Trivy Scan,18,0,CVE-2025-69418 Libssl3 3.0.17-1~deb12u2,False,False,,2026-04-12 12:35:36.479251+00:00,,True,,,,Trivy Scan,3,Labs Security Testing Final,1,Juice Shop,,CVE-2025-69418,debian; os-pkgs,"Active, Verified",
,,True,0,[],libssl3,3.0.17-1~deb12u2,2026-04-12 12:35:36.487270+00:00,CVSS:3.1/AV:N/AC:H/PR:N/UI:N/S:U/C:N/I:N/A:H,5.9,,,754,2026-04-12,,,"openssl: OpenSSL: Denial of Service via malformed TimeStamp Response NEWLINE **Target:** bkimminich/juice-shop:v19.0.0 (debian 12.11) NEWLINE **Type:** debian NEWLINE **Fixed version:** 3.0.18-1~deb12u2 NEWLINE  NEWLINE Issue summary: A type confusion vulnerability exists in the TimeStamp Response NEWLINE verification code where an ASN1_TYPE union member is accessed without first NEWLINE validating the type, causing an invalid or NULL pointer dereference when NEWLINE processing a malformed TimeStamp Response file. NEWLINE  NEWLINE Impact summary: An application calling TS_RESP_verify_response() with a NEWLINE malformed TimeStamp Response can be caused to dereference an invalid or NEWLINE NULL pointer when reading, resulting in a Denial of Service. NEWLINE  NEWLINE The functions ossl_ess_get_signing_cert() and ossl_ess_get_signing_cert_v2() NEWLINE access the signing cert attribute value without validating its type. NEWLINE When the type is not V_ASN1_SEQUENCE, this results in accessing invalid memory NEWLINE through the ASN1_TYPE union, causing a crash. NEWLINE  NEWLINE Exploiting this vulnerability requires an attacker to provide a malformed NEWLINE TimeStamp Response to an application that verifies timestamp responses. The NEWLINE TimeStamp protocol (RFC 3161) is not widely used and the impact of the NEWLINE exploit is just a Denial of Service. For these reasons the issue was NEWLINE assessed as Low severity. NEWLINE  NEWLINE The FIPS modules in 3.5, 3.4, 3.3 and 3.0 are not affected by this issue, NEWLINE as the TimeStamp Response implementation is outside the OpenSSL FIPS module NEWLINE boundary. NEWLINE  NEWLINE OpenSSL 3.6, 3.5, 3.4, 3.3, 3.0 and 1.1.1 are vulnerable to this issue. NEWLINE  NEWLINE OpenSSL 1.0.2 is not affected by this issue. NEWLINE ",False,,,False,,,,False,bkimminich/juice-shop:v19.0.0 (debian 12.11),,True,,True,False,,False,,c5db70cca9f43fc97262d1a0f45d04c7b7aa92242737a2cd73bce2f5c291583c,703,fixed,False,,False,2026-04-12 12:35:36.239086+00:00,Admin User (admin),1,2026-04-12 12:35:36.487314+00:00,,,,,0,[],3.0.18-1~deb12u2,,S2,False,,,,,,,,False,https://access.redhat.com/errata/RHSA-2026:1473 NEWLINE https://access.redhat.com/security/cve/CVE-2025-69420 NEWLINE https://bugzilla.redhat.com/2430375 NEWLINE https://bugzilla.redhat.com/2430376 NEWLINE https://bugzilla.redhat.com/2430377 NEWLINE https://bugzilla.redhat.com/2430378 NEWLINE https://bugzilla.redhat.com/2430379 NEWLINE https://bugzilla.redhat.com/2430380 NEWLINE https://bugzilla.redhat.com/2430381 NEWLINE https://bugzilla.redhat.com/2430386 NEWLINE https://bugzilla.redhat.com/2430387 NEWLINE https://bugzilla.redhat.com/2430388 NEWLINE https://bugzilla.redhat.com/2430389 NEWLINE https://bugzilla.redhat.com/2430390 NEWLINE https://bugzilla.redhat.com/show_bug.cgi?id=2430375 NEWLINE https://bugzilla.redhat.com/show_bug.cgi?id=2430376 NEWLINE https://bugzilla.redhat.com/show_bug.cgi?id=2430377 NEWLINE https://bugzilla.redhat.com/show_bug.cgi?id=2430378 NEWLINE https://bugzilla.redhat.com/show_bug.cgi?id=2430379 NEWLINE https://bugzilla.redhat.com/show_bug.cgi?id=2430380 NEWLINE https://bugzilla.redhat.com/show_bug.cgi?id=2430381 NEWLINE https://bugzilla.redhat.com/show_bug.cgi?id=2430386 NEWLINE https://bugzilla.redhat.com/show_bug.cgi?id=2430387 NEWLINE https://bugzilla.redhat.com/show_bug.cgi?id=2430388 NEWLINE https://bugzilla.redhat.com/show_bug.cgi?id=2430389 NEWLINE https://bugzilla.redhat.com/show_bug.cgi?id=2430390 NEWLINE https://cve.mitre.org/cgi-bin/cvename.cgi?name=CVE-2025-11187 NEWLINE https://cve.mitre.org/cgi-bin/cvename.cgi?name=CVE-2025-15467 NEWLINE https://cve.mitre.org/cgi-bin/cvename.cgi?name=CVE-2025-15468 NEWLINE https://cve.mitre.org/cgi-bin/cvename.cgi?name=CVE-2025-15469 NEWLINE https://cve.mitre.org/cgi-bin/cvename.cgi?name=CVE-2025-66199 NEWLINE https://cve.mitre.org/cgi-bin/cvename.cgi?name=CVE-2025-68160 NEWLINE https://cve.mitre.org/cgi-bin/cvename.cgi?name=CVE-2025-69418 NEWLINE https://cve.mitre.org/cgi-bin/cvename.cgi?name=CVE-2025-69419 NEWLINE https://cve.mitre.org/cgi-bin/cvename.cgi?name=CVE-2025-69420 NEWLINE https://cve.mitre.org/cgi-bin/cvename.cgi?name=CVE-2025-69421 NEWLINE https://cve.mitre.org/cgi-bin/cvename.cgi?name=CVE-2026-22795 NEWLINE https://cve.mitre.org/cgi-bin/cvename.cgi?name=CVE-2026-22796 NEWLINE https://errata.almalinux.org/9/ALSA-2026-1473.html NEWLINE https://errata.rockylinux.org/RLSA-2026:1473 NEWLINE https://github.com/openssl/openssl/commit/27c7012c91cc986a598d7540f3079dfde2416eb9 NEWLINE https://github.com/openssl/openssl/commit/4e254b48ad93cc092be3dd62d97015f33f73133a NEWLINE https://github.com/openssl/openssl/commit/564fd9c73787f25693bf9e75faf7bf6bb1305d4e NEWLINE https://github.com/openssl/openssl/commit/5eb0770ffcf11b785cf374ff3c19196245e54f1b NEWLINE https://github.com/openssl/openssl/commit/a99349ebfc519999edc50620abe24d599b9eb085 NEWLINE https://linux.oracle.com/cve/CVE-2025-69420.html NEWLINE https://linux.oracle.com/errata/ELSA-2026-50081.html NEWLINE https://nvd.nist.gov/vuln/detail/CVE-2025-69420 NEWLINE https://openssl-library.org/news/secadv/20260127.txt NEWLINE https://ubuntu.com/security/notices/USN-7980-1 NEWLINE https://ubuntu.com/security/notices/USN-7980-2 NEWLINE https://www.cve.org/CVERecord?id=CVE-2025-69420,Admin User (admin),1,,,False,,,,,,,Medium,,1,90,89,2026-07-11,2026-07-11,,,,True,,Trivy Scan,18,0,CVE-2025-69420 Libssl3 3.0.17-1~deb12u2,False,False,,2026-04-12 12:35:36.487276+00:00,,True,,,,Trivy Scan,3,Labs Security Testing Final,1,Juice Shop,,CVE-2025-69420,debian; os-pkgs,"Active, Verified",
,,True,0,[],libssl3,3.0.17-1~deb12u2,2026-04-12 12:35:36.495000+00:00,CVSS:3.1/AV:N/AC:H/PR:N/UI:N/S:U/C:L/I:L/A:L,5.6,,,125,2026-04-12,,,"openssl: Out-of-bounds read & write in RFC 3211 KEK Unwrap NEWLINE **Target:** bkimminich/juice-shop:v19.0.0 (debian 12.11) NEWLINE **Type:** debian NEWLINE **Fixed version:** 3.0.17-1~deb12u3 NEWLINE  NEWLINE Issue summary: An application trying to decrypt CMS messages encrypted using NEWLINE password based encryption can trigger an out-of-bounds read and write. NEWLINE  NEWLINE Impact summary: This out-of-bounds read may trigger a crash which leads to NEWLINE Denial of Service for an application. The out-of-bounds write can cause NEWLINE a memory corruption which can have various consequences including NEWLINE a Denial of Service or Execution of attacker-supplied code. NEWLINE  NEWLINE Although the consequences of a successful exploit of this vulnerability NEWLINE could be severe, the probability that the attacker would be able to NEWLINE perform it is low. Besides, password based (PWRI) encryption support in CMS NEWLINE messages is very rarely used. For that reason the issue was assessed as NEWLINE Moderate severity according to our Security Policy. NEWLINE  NEWLINE The FIPS modules in 3.5, 3.4, 3.3, 3.2, 3.1 and 3.0 are not affected by this NEWLINE issue, as the CMS implementation is outside the OpenSSL FIPS module NEWLINE boundary. NEWLINE ",False,,,False,,,,False,bkimminich/juice-shop:v19.0.0 (debian 12.11),,True,,True,False,,False,,4cb161b0ffffa9082fc32d11962234e5c81e131f80ad03a727f7f6ace92c1a1a,704,fixed,False,,False,2026-04-12 12:35:36.239086+00:00,Admin User (admin),1,2026-04-12 12:35:36.495061+00:00,,,,,0,[],3.0.17-1~deb12u3,,S2,False,,,,,,,,False,http://www.openwall.com/lists/oss-security/2025/09/30/5 NEWLINE https://access.redhat.com/errata/RHSA-2026:2776 NEWLINE https://access.redhat.com/security/cve/CVE-2025-9230 NEWLINE https://bugzilla.redhat.com/2396054 NEWLINE https://bugzilla.redhat.com/show_bug.cgi?id=2396054 NEWLINE https://cve.mitre.org/cgi-bin/cvename.cgi?name=CVE-2025-9230 NEWLINE https://errata.almalinux.org/9/ALSA-2026-2776.html NEWLINE https://errata.rockylinux.org/RLSA-2025:21255 NEWLINE https://github.com/openssl/openssl/commit/5965ea5dd6960f36d8b7f74f8eac67a8eb8f2b45 NEWLINE https://github.com/openssl/openssl/commit/9e91358f365dee6c446dcdcdb01c04d2743fd280 NEWLINE https://github.com/openssl/openssl/commit/a79c4ce559c6a3a8fd4109e9f33c1185d5bf2def NEWLINE https://github.com/openssl/openssl/commit/b5282d677551afda7d20e9c00e09561b547b2dfd NEWLINE https://github.com/openssl/openssl/commit/bae259a211ada6315dc50900686daaaaaa55f482 NEWLINE https://github.openssl.org/openssl/extended-releases/commit/c2b96348bfa662f25f4fabf81958ae822063dae3 NEWLINE https://github.openssl.org/openssl/extended-releases/commit/dfbaf161d8dafc1132dd88cd48ad990ed9b4c8ba NEWLINE https://linux.oracle.com/cve/CVE-2025-9230.html NEWLINE https://linux.oracle.com/errata/ELSA-2026-50114.html NEWLINE https://lists.debian.org/debian-lts-announce/2025/10/msg00001.html NEWLINE https://nvd.nist.gov/vuln/detail/CVE-2025-9230 NEWLINE https://openssl-library.org/news/secadv/20250930.txt NEWLINE https://ubuntu.com/security/notices/USN-7786-1 NEWLINE https://www.cve.org/CVERecord?id=CVE-2025-9230,Admin User (admin),1,,,False,,,,,,,Medium,,1,90,89,2026-07-11,2026-07-11,,,,True,,Trivy Scan,18,0,CVE-2025-9230 Libssl3 3.0.17-1~deb12u2,False,False,,2026-04-12 12:35:36.495006+00:00,,True,,,,Trivy Scan,3,Labs Security Testing Final,1,Juice Shop,,CVE-2025-9230,debian; os-pkgs,"Active, Verified",
